{
  "instance_id": "fixture_ai_closed_missing_evidence",
  "repo": "synthetic/agent-config",
  "pr_number": 102,
  "pr_url": "https://github.com/synthetic/agent-config/pull/102",
  "fetched_at": "2026-06-13T00:00:00Z",
  "fetch_mode": "fixture",
  "manifest_metadata": {},
  "pr": {
    "title": "Refactor config loader",
    "body": "Refactors the config loader implementation.",
    "created_at": "2026-06-02T12:00:00Z",
    "user": {"login": "agent-claude-bot"}
  },
  "commits": [
    {"sha": "def101", "message": "refactor config loader"}
  ],
  "files": [
    {"filename": "src/config/loader.ts", "status": "modified", "additions": 40, "deletions": 34}
  ],
  "reviews": [
    {"user": "maintainer-b", "state": "CHANGES_REQUESTED", "body": "Please add tests and explain the requirements."}
  ],
  "review_comments": [
    {"path": "src/config/loader.ts", "body": "This is hard to assess without more evidence."}
  ],
  "issue_comments": [],
  "checks": [],
  "linked_issues": [],
  "errors": []
}
